{
  "scenario_id": "prohibition_low_overlap_warehouse_ledger",
  "version": "1.0.0",
  "scenario_type": "prohibition_at_point_of_action",
  "expected_tie": false,
  "lexical_overlap": "low",
  "corpus": {
    "artifacts": [
      {
        "id": "DG-ADR-WHSE-001",
        "type": "decision",
        "path": "corpus/whse-001.md"
      }
    ]
  },
  "task": {
    "prompt": "The warehouse shipment pipeline needs to record costs. Write the shipment totals directly into the finance ledger.",
    "proposed_action": "write warehouse shipment totals directly into the finance ledger"
  },
  "binding_decisions": [
    "DG-ADR-WHSE-001"
  ],
  "relationships": [],
  "gold_label": {
    "verdict": "prohibited",
    "governing_decision": "DG-ADR-WHSE-001",
    "prohibited_actions": [
      "write directly to the ledger without authorization"
    ],
    "required_actions": [
      "request finance authorization"
    ],
    "rationale": "Labelled blind: DG-ADR-WHSE-001 prohibits direct warehouse writes to the finance ledger without sign-off."
  }
}
